{
    "$schema" : "http://json-schema.org/draft-07/schema#",
    "type" : "object",
    "properties" : {
        "@context" : {
            "type" : "array",
            "items" : {
                "type" : "string"
            }
        },
        "credentialSchema" : {
            "type" : "object",
            "properties" : {
                "id" : {
                    "type" : "string"
                },
                "type" : {
                    "type" : "string"
                }
            },
            "additionalProperties" : false
        },
        "credentialStatus" : {
            "type" : "object",
            "properties" : {
                "id" : {
                    "type" : "string"
                },
                "type" : {
                    "type" : "string"
                }
            },
            "additionalProperties" : false
        },
        "credentialSubject" : {
            "type" : "object",
            "properties" : {
                "currentAddress" : {
                    "type" : "array",
                    "items" : {
                        "type" : "string"
                    }
                },
                "dateOfBirth" : {
                    "type" : "string"
                },
                "familyName" : {
                    "type" : "string"
                },
                "firstName" : {
                    "type" : "string"
                },
                "gender" : {
                    "type" : "string"
                },
                "id" : {
                    "type" : "string"
                },
                "identifier" : {
                    "type" : "array",
                    "items" : {
                        "type" : "object",
                        "properties" : {
                            "schemeID" : {
                                "type" : "string"
                            },
                            "value" : {
                                "type" : "string"
                            }
                        },
                        "additionalProperties" : false
                    }
                },
                "nameAndFamilyNameAtBirth" : {
                    "type" : "string"
                },
                "matriculationNumber" : {
                    "type" : "string"
                },
                "placeOfBirth" : {
                    "type" : "string"
                }
            },
            "additionalProperties" : false
        },
        "evidence" : {
            "type" : "array",
            "items" : {
                "type" : "object",
                "properties" : {
                    "documentPresence" : {
                        "type" : "array",
                        "items" : {
                            "type" : "string"
                        }
                    },
                    "evidenceDocument" : {
                        "type" : "array",
                        "items" : {
                            "type" : "string"
                        }
                    },
                    "id" : {
                        "type" : "string"
                    },
                    "subjectPresence" : {
                        "type" : "string"
                    },
                    "type" : {
                        "type" : "array",
                        "items" : {
                            "type" : "string"
                        }
                    },
                    "verifier" : {
                        "type" : "string"
                    }
                },
                "additionalProperties" : false
            }
        },
        "expirationDate" : {
            "type" : "string"
        },
        "id" : {
            "type" : "string"
        },
        "issuanceDate" : {
            "type" : "string"
        },
        "issued" : {
            "type" : "string"
        },
        "issuer" : {
            "type" : "string"
        },
        "proof" : {
            "type" : "object",
            "properties" : {
                "created" : {
                    "type" : "string"
                },
                "creator" : {
                    "type" : "string"
                },
                "domain" : {
                    "type" : "string"
                },
                "jws" : {
                    "type" : "string"
                },
                "nonce" : {
                    "type" : "string"
                },
                "proofPurpose" : {
                    "type" : "string"
                },
                "type" : {
                    "type" : "string"
                },
                "verificationMethod" : {
                    "type" : "string"
                }
            },
            "additionalProperties" : false
        },
        "type" : {
            "type" : "array",
            "items" : {
                "type" : "string"
            }
        },
        "validFrom" : {
            "type" : "string"
        }
    },
    "required" : [ "@context", "type" ],
    "title" : "EBSI Natural Person Verifiable ID",
    "description" : "Schema of an EBSI Verifiable ID for a natural person",
    "additionalProperties" : false
}
